{"schema_version":"gocode.rc0.policy-activation-intent/2","repository_id":"gocode","project_owner_authority_receipt_sha256":"aaaaaaaaaaaaaaaaaaaaaaaaaaaaaaaaaaaaaaaaaaaaaaaaaaaaaaaaaaaaaaaa","mapping_policy_envelope_sha256":"2222222222222222222222222222222222222222222222222222222222222222","activation_intent_envelope_sha256":"3333333333333333333333333333333333333333333333333333333333333333","activation_epoch":1,"predecessor_activation_snapshot_envelope_sha256":null}
